{
  "preset_id": "std.architecture.glass_corridor_sunset",
  "preset_sha256": "32ce38cb643987df70a8f12ccf2f1d91d0fd0bd24b2bf316dac09139a5b0cee8",
  "preset_version": "1.0.0",
  "prompt_sha256": "9e9814f2f995e0cca142b32400d66c51f821748b0f2c94b727ac30027ca6d062",
  "reference_pack_id": "pack.std.architecture.glass_corridor_sunset.v1.1",
  "references": [
    {
      "media_type": "application/json",
      "not_authority_for": [
        "identity",
        "body",
        "hair",
        "outfit"
      ],
      "reference_id": "std.architecture.glass_corridor_sunset.environment",
      "role": "environment_anchor",
      "sha256": "f3bf479ff5385a91375f3326a9150236976f0e9053a0c617dad86bbecbf82666"
    },
    {
      "media_type": "application/json",
      "not_authority_for": [
        "identity",
        "body",
        "hair",
        "outfit"
      ],
      "reference_id": "std.architecture.glass_corridor_sunset.lighting",
      "role": "lighting_anchor",
      "sha256": "9984ba36739f15567347e39cc047cd42dae57c05922b1c16fe45a1319c07e9f7"
    },
    {
      "media_type": "application/json",
      "not_authority_for": [
        "identity",
        "body",
        "hair",
        "outfit"
      ],
      "reference_id": "std.architecture.glass_corridor_sunset.composition",
      "role": "composition_anchor",
      "sha256": "2217cac41aee3f4b30716465a41fee37885fd02ad84e8c3a51b8c4a210b6b03b"
    },
    {
      "media_type": "application/json",
      "not_authority_for": [
        "identity",
        "body",
        "hair",
        "outfit"
      ],
      "reference_id": "std.architecture.glass_corridor_sunset.palette",
      "role": "palette_anchor",
      "sha256": "25b04cea718e961f8ccf96ac79c4d0e6e408876263621c41736b69ce7975de19"
    },
    {
      "media_type": "application/json",
      "not_authority_for": [
        "identity",
        "body",
        "hair",
        "outfit"
      ],
      "reference_id": "std.architecture.glass_corridor_sunset.negative",
      "role": "negative_reference",
      "sha256": "28a91a379861ea61de6f86ccc96459ad1fb1fa61423ff1cf7ee7156b27efa9eb"
    }
  ],
  "schema_version": "1.0.0",
  "source_ledger": {
    "created_at": "2026-07-23T09:40:00Z",
    "ledger_id": "ledger.std.architecture.glass_corridor_sunset.v1",
    "preset_id": "std.architecture.glass_corridor_sunset",
    "preset_version": "1.0.0",
    "revision": 1,
    "schema_version": "1.0.0",
    "sources": [
      {
        "content_sha256": "0d6e972252a5e782abe3b2f268825acb4eacb2f8f45b5a3c383830e553f3a665",
        "not_authority_for": [
          "identity",
          "body",
          "hair",
          "outfit",
          "brands",
          "readable_text",
          "exact_architecture"
        ],
        "retrieved_at": "2026-07-23T09:40:00Z",
        "rights": {
          "basis": "LICENSED",
          "evidence_sha256": "86a558a192adac12108998fb02dd40db4b72dc06a04c09719d47db91854dacb5",
          "evidence_uri": "evidence/licenses/unsplash-license-2026-07-23.md",
          "rights_holder": "Declan Sun via Unsplash license",
          "status": "VERIFIED",
          "verified_at": "2026-07-23T09:40:00Z"
        },
        "role": "environment_and_composition_inspiration",
        "snapshot_uri": "evidence/scene-sources/unsplash.G5dKqL8nU1w.json",
        "source_id": "unsplash.G5dKqL8nU1w",
        "url": "https://unsplash.com/photos/modern-architectures-glass-facade-in-contrasting-sunlight-G5dKqL8nU1w",
        "use": "glass facade geometry, clean lines and sunset reflection behavior only"
      },
      {
        "content_sha256": "f3ca074e5748169fa3dff7d375bc8e534c0d47bb7e7cbc7e8ddc09f5ae90c69e",
        "not_authority_for": [
          "identity",
          "body",
          "hair",
          "outfit",
          "brands",
          "readable_text",
          "exact_architecture"
        ],
        "retrieved_at": "2026-07-23T09:40:00Z",
        "rights": {
          "basis": "LICENSED",
          "evidence_sha256": "86a558a192adac12108998fb02dd40db4b72dc06a04c09719d47db91854dacb5",
          "evidence_uri": "evidence/licenses/unsplash-license-2026-07-23.md",
          "rights_holder": "Felicia Varzari via Unsplash license",
          "status": "VERIFIED",
          "verified_at": "2026-07-23T09:40:00Z"
        },
        "role": "environment_material_inspiration",
        "snapshot_uri": "evidence/scene-sources/unsplash.uJ2kLq8mN5p.json",
        "source_id": "unsplash.uJ2kLq8mN5p",
        "url": "https://unsplash.com/photos/architectural-glass-reflects-a-modern-building-uJ2kLq8mN5p",
        "use": "polished floor reflection and minimalist architectural scale only"
      }
    ],
    "status": "VERIFIED_FOR_RELEASE"
  },
  "version": "1.1.0"
}
