{
  "preset_id": "std.city.amber_alley_cobblestone",
  "preset_sha256": "d71eead2eb8ed02032a3495f083443dd77abe83e37d8620edf738f65a7828dd0",
  "preset_version": "1.0.0",
  "prompt_sha256": "f9ca091d2b89a7ff37ffcb5bd3ce9986b41a9571027cfd2189815e33f0868c8e",
  "reference_pack_id": "pack.std.city.amber_alley_cobblestone.v1.1",
  "references": [
    {
      "media_type": "application/json",
      "not_authority_for": [
        "identity",
        "body",
        "hair",
        "outfit"
      ],
      "reference_id": "std.city.amber_alley_cobblestone.environment",
      "role": "environment_anchor",
      "sha256": "a7dd952ef5fb7687961c68fa30a33773ab9b36a77225fe771f58cfa1580896cb"
    },
    {
      "media_type": "application/json",
      "not_authority_for": [
        "identity",
        "body",
        "hair",
        "outfit"
      ],
      "reference_id": "std.city.amber_alley_cobblestone.lighting",
      "role": "lighting_anchor",
      "sha256": "d272329fbbc70112dca2c91078d8d008da70a1c07e1d484c34ce4a422ec65a54"
    },
    {
      "media_type": "application/json",
      "not_authority_for": [
        "identity",
        "body",
        "hair",
        "outfit"
      ],
      "reference_id": "std.city.amber_alley_cobblestone.composition",
      "role": "composition_anchor",
      "sha256": "1303554a5b10f3a3a4d7865d3b7eeae68a6718d76521fc66f362bc0b5c7ab061"
    },
    {
      "media_type": "application/json",
      "not_authority_for": [
        "identity",
        "body",
        "hair",
        "outfit"
      ],
      "reference_id": "std.city.amber_alley_cobblestone.palette",
      "role": "palette_anchor",
      "sha256": "6805ef9f6ac35cccb48ed971b2c419437dfc0a344404d198aeabd5086f0ef662"
    },
    {
      "media_type": "application/json",
      "not_authority_for": [
        "identity",
        "body",
        "hair",
        "outfit"
      ],
      "reference_id": "std.city.amber_alley_cobblestone.negative",
      "role": "negative_reference",
      "sha256": "12d4216a36bc449d76f29adf73a5b766b62acb6ee66c2509bafa43f3480a6cce"
    }
  ],
  "schema_version": "1.0.0",
  "source_ledger": {
    "created_at": "2026-07-23T09:40:00Z",
    "ledger_id": "ledger.std.city.amber_alley_cobblestone.v1",
    "preset_id": "std.city.amber_alley_cobblestone",
    "preset_version": "1.0.0",
    "revision": 1,
    "schema_version": "1.0.0",
    "sources": [
      {
        "content_sha256": "240db191c3d5850c17392292420e90ec007cb6c0c491f920c256a1a94ce20a06",
        "not_authority_for": [
          "identity",
          "body",
          "hair",
          "outfit",
          "brands",
          "readable_text",
          "exact_architecture"
        ],
        "retrieved_at": "2026-07-23T09:40:00Z",
        "rights": {
          "basis": "LICENSED",
          "evidence_sha256": "86a558a192adac12108998fb02dd40db4b72dc06a04c09719d47db91854dacb5",
          "evidence_uri": "evidence/licenses/unsplash-license-2026-07-23.md",
          "rights_holder": "Desmond Leung via Unsplash license",
          "status": "VERIFIED",
          "verified_at": "2026-07-23T09:40:00Z"
        },
        "role": "lighting_composition_palette_inspiration",
        "snapshot_uri": "evidence/scene-sources/unsplash.v095s_t1_6o.json",
        "source_id": "unsplash.v095s_t1_6o",
        "url": "https://unsplash.com/photos/concrete-road-beside-building-v095s_t1_6o",
        "use": "warm amber backlight behavior, wet cobblestone reflections and narrow street depth only"
      },
      {
        "content_sha256": "8be5e15f4c2f3e71ddb68931c7411aece3da927dfd7b03967ecd8bbb8280ddcc",
        "not_authority_for": [
          "identity",
          "body",
          "hair",
          "outfit",
          "brands",
          "readable_text",
          "exact_architecture"
        ],
        "retrieved_at": "2026-07-23T09:40:00Z",
        "rights": {
          "basis": "LICENSED",
          "evidence_sha256": "86a558a192adac12108998fb02dd40db4b72dc06a04c09719d47db91854dacb5",
          "evidence_uri": "evidence/licenses/unsplash-license-2026-07-23.md",
          "rights_holder": "Darien Attridge via Unsplash license",
          "status": "VERIFIED",
          "verified_at": "2026-07-23T09:40:00Z"
        },
        "role": "environment_material_inspiration",
        "snapshot_uri": "evidence/scene-sources/unsplash.X19Lp3_Kk_Q.json",
        "source_id": "unsplash.X19Lp3_Kk_Q",
        "url": "https://unsplash.com/photos/a-car-driving-down-a-rain-soaked-street-at-night-X19Lp3_Kk-Q",
        "use": "secondary wet surface reflection behavior and atmospheric haze only"
      }
    ],
    "status": "VERIFIED_FOR_RELEASE"
  },
  "version": "1.1.0"
}
