{
  "preset_id": "std.interior.sheer_curtain_golden_light",
  "preset_sha256": "10f52fbd344084a72cdb0e7103e14a60a372d4e37858bd6b501035c538f37640",
  "preset_version": "1.0.0",
  "prompt_sha256": "103298c0f7451e0daa74fb718e3f65ca61f550e44423832ebbe58c64eeb0b0ea",
  "reference_pack_id": "pack.std.interior.sheer_curtain_golden_light.v1.1",
  "references": [
    {
      "media_type": "application/json",
      "not_authority_for": [
        "identity",
        "body",
        "hair",
        "outfit"
      ],
      "reference_id": "std.interior.sheer_curtain_golden_light.environment",
      "role": "environment_anchor",
      "sha256": "da9940298b46ffa7dc6b5c7918d5484e712c40d41f60806986f6e794095f992f"
    },
    {
      "media_type": "application/json",
      "not_authority_for": [
        "identity",
        "body",
        "hair",
        "outfit"
      ],
      "reference_id": "std.interior.sheer_curtain_golden_light.lighting",
      "role": "lighting_anchor",
      "sha256": "175ded1df5ba3ce983b6e8157a1dcabb89c890a8ac1e71dd29912937a51590b0"
    },
    {
      "media_type": "application/json",
      "not_authority_for": [
        "identity",
        "body",
        "hair",
        "outfit"
      ],
      "reference_id": "std.interior.sheer_curtain_golden_light.composition",
      "role": "composition_anchor",
      "sha256": "1303554a5b10f3a3a4d7865d3b7eeae68a6718d76521fc66f362bc0b5c7ab061"
    },
    {
      "media_type": "application/json",
      "not_authority_for": [
        "identity",
        "body",
        "hair",
        "outfit"
      ],
      "reference_id": "std.interior.sheer_curtain_golden_light.palette",
      "role": "palette_anchor",
      "sha256": "db1fb08b4e2b1d6e21c78ae833d871504da935f504626e05a801a17db3bab364"
    },
    {
      "media_type": "application/json",
      "not_authority_for": [
        "identity",
        "body",
        "hair",
        "outfit"
      ],
      "reference_id": "std.interior.sheer_curtain_golden_light.negative",
      "role": "negative_reference",
      "sha256": "ad5774a23b06137f9d544321995072c0f032e8388f2f3a3583b1516810806186"
    }
  ],
  "schema_version": "1.0.0",
  "source_ledger": {
    "created_at": "2026-07-23T09:40:00Z",
    "ledger_id": "ledger.std.interior.sheer_curtain_golden_light.v1",
    "preset_id": "std.interior.sheer_curtain_golden_light",
    "preset_version": "1.0.0",
    "revision": 1,
    "schema_version": "1.0.0",
    "sources": [
      {
        "content_sha256": "3aba1226cfd2b15c4d30cd3f04e5c54f16021c2695b22d363d7d0789fa9ecc93",
        "not_authority_for": [
          "identity",
          "body",
          "hair",
          "outfit",
          "brands",
          "readable_text",
          "exact_architecture"
        ],
        "retrieved_at": "2026-07-23T09:40:00Z",
        "rights": {
          "basis": "LICENSED",
          "evidence_sha256": "86a558a192adac12108998fb02dd40db4b72dc06a04c09719d47db91854dacb5",
          "evidence_uri": "evidence/licenses/unsplash-license-2026-07-23.md",
          "rights_holder": "Chris Lee via Unsplash license",
          "status": "VERIFIED",
          "verified_at": "2026-07-23T09:40:00Z"
        },
        "role": "environment_and_composition_inspiration",
        "snapshot_uri": "evidence/scene-sources/unsplash.t54XqY9aK5s.json",
        "source_id": "unsplash.t54XqY9aK5s",
        "url": "https://unsplash.com/photos/a-large-glass-greenhouse-with-an-open-door-t54XqY9aK5s",
        "use": "soft filtered light through fabric and tall window proportion only"
      },
      {
        "content_sha256": "3f4e54c899323369483f4b76fcd449c9165048bd0cf594b8e35285374fd5e137",
        "not_authority_for": [
          "identity",
          "body",
          "hair",
          "outfit",
          "brands",
          "readable_text",
          "exact_architecture"
        ],
        "retrieved_at": "2026-07-23T09:40:00Z",
        "rights": {
          "basis": "LICENSED",
          "evidence_sha256": "86a558a192adac12108998fb02dd40db4b72dc06a04c09719d47db91854dacb5",
          "evidence_uri": "evidence/licenses/unsplash-license-2026-07-23.md",
          "rights_holder": "Alena Lavrova via Unsplash license",
          "status": "VERIFIED",
          "verified_at": "2026-07-23T09:40:00Z"
        },
        "role": "environment_material_inspiration",
        "snapshot_uri": "evidence/scene-sources/unsplash.9XlqHqK5zV8.json",
        "source_id": "unsplash.9XlqHqK5zV8",
        "url": "https://unsplash.com/photos/a-glass-greenhouse-with-greenery-and-walkways-9XlqHqK5zV8",
        "use": "diffused daylight softness and atmospheric particles in light only"
      }
    ],
    "status": "VERIFIED_FOR_RELEASE"
  },
  "version": "1.1.0"
}
