{
  "preset_id": "std.studio.black_spotlight_low_key",
  "preset_sha256": "ed46a44226aedca0b9ca3a3fc3442fcc62089918a090394d9abf2b50eb911c32",
  "preset_version": "1.0.0",
  "prompt_sha256": "70277cdf4b7e371cee586a62cdc8a2e618d3cb4b12e089f7fd779b0b5c3ea220",
  "reference_pack_id": "pack.std.studio.black_spotlight_low_key.v1.1",
  "references": [
    {
      "media_type": "application/json",
      "not_authority_for": [
        "identity",
        "body",
        "hair",
        "outfit"
      ],
      "reference_id": "std.studio.black_spotlight_low_key.environment",
      "role": "environment_anchor",
      "sha256": "b5c2ce51a11f41d180beaf8fd562af23713d1967db8c035c91b15ac834181f27"
    },
    {
      "media_type": "application/json",
      "not_authority_for": [
        "identity",
        "body",
        "hair",
        "outfit"
      ],
      "reference_id": "std.studio.black_spotlight_low_key.lighting",
      "role": "lighting_anchor",
      "sha256": "5b63aaf3614f751ff55e8a6c89d6167630da2c59dcf07702beea229564118352"
    },
    {
      "media_type": "application/json",
      "not_authority_for": [
        "identity",
        "body",
        "hair",
        "outfit"
      ],
      "reference_id": "std.studio.black_spotlight_low_key.composition",
      "role": "composition_anchor",
      "sha256": "16ceb5ed7ab3d79c30d32398d644ffe099cfe2ed94875a1b67b1562a2faa800c"
    },
    {
      "media_type": "application/json",
      "not_authority_for": [
        "identity",
        "body",
        "hair",
        "outfit"
      ],
      "reference_id": "std.studio.black_spotlight_low_key.palette",
      "role": "palette_anchor",
      "sha256": "519fd37889e7120e22f8c44e9ccfe6a26b72d39cd0fa9b5409839acbde221e8a"
    },
    {
      "media_type": "application/json",
      "not_authority_for": [
        "identity",
        "body",
        "hair",
        "outfit"
      ],
      "reference_id": "std.studio.black_spotlight_low_key.negative",
      "role": "negative_reference",
      "sha256": "40e7087d1831620a41d89e2d8d0ee587386e8d1565291ffe9dee5ffca010e5b0"
    }
  ],
  "schema_version": "1.0.0",
  "source_ledger": {
    "created_at": "2026-07-23T09:40:00Z",
    "ledger_id": "ledger.std.studio.black_spotlight_low_key.v1",
    "preset_id": "std.studio.black_spotlight_low_key",
    "preset_version": "1.0.0",
    "revision": 1,
    "schema_version": "1.0.0",
    "sources": [
      {
        "content_sha256": "fd455f4cd2b40d1fd26f54bf281b703b304d3872fe660ed5d58a542f7d079e81",
        "not_authority_for": [
          "identity",
          "body",
          "hair",
          "outfit",
          "brands",
          "readable_text",
          "exact_architecture"
        ],
        "retrieved_at": "2026-07-23T09:40:00Z",
        "rights": {
          "basis": "LICENSED",
          "evidence_sha256": "86a558a192adac12108998fb02dd40db4b72dc06a04c09719d47db91854dacb5",
          "evidence_uri": "evidence/licenses/unsplash-license-2026-07-23.md",
          "rights_holder": "Studio Republic via Unsplash license",
          "status": "VERIFIED",
          "verified_at": "2026-07-23T09:40:00Z"
        },
        "role": "lighting_composition_palette_inspiration",
        "snapshot_uri": "evidence/scene-sources/unsplash.mC1J_w3_Z54.json",
        "source_id": "unsplash.mC1J_w3_Z54",
        "url": "https://unsplash.com/photos/black-microphone-in-dimmed-room-mC1J-w3-Z54",
        "use": "pitch black studio void and directional spotlight behavior only"
      },
      {
        "content_sha256": "60759cd48bb2659c3eb7d235898682394f23d97d7189636f5833cd8d1dc58cda",
        "not_authority_for": [
          "identity",
          "body",
          "hair",
          "outfit",
          "brands",
          "readable_text",
          "exact_architecture"
        ],
        "retrieved_at": "2026-07-23T09:40:00Z",
        "rights": {
          "basis": "LICENSED",
          "evidence_sha256": "86a558a192adac12108998fb02dd40db4b72dc06a04c09719d47db91854dacb5",
          "evidence_uri": "evidence/licenses/unsplash-license-2026-07-23.md",
          "rights_holder": "Unsplash Contributor via Unsplash license",
          "status": "VERIFIED",
          "verified_at": "2026-07-23T09:40:00Z"
        },
        "role": "environment_material_inspiration",
        "snapshot_uri": "evidence/scene-sources/unsplash.r3am9AchMDH.json",
        "source_id": "unsplash.r3am9AchMDH",
        "url": "https://unsplash.com/photos/young-woman-in-streetwear-posing-against-black-wall-r3am9AchMDH",
        "use": "pure black seamless backdrop absorption and rim-light separation only"
      }
    ],
    "status": "VERIFIED_FOR_RELEASE"
  },
  "version": "1.1.0"
}
