{
  "preset_id": "std.interior.gallery_morning_gloss",
  "preset_sha256": "d0291e5d657e87b7384078facdc4689231968ebfd19f09c13425a44942ccd3ef",
  "preset_version": "1.0.0",
  "prompt_sha256": "3e73a1f2ff0c9cf20dc84ce9dd1ea85ba4c78e96816a0fbe391104a2ef9c13b9",
  "reference_pack_id": "pack.std.interior.gallery_morning_gloss.v1.1",
  "references": [
    {
      "media_type": "application/json",
      "not_authority_for": [
        "identity",
        "body",
        "hair",
        "outfit"
      ],
      "reference_id": "std.interior.gallery_morning_gloss.environment",
      "role": "environment_anchor",
      "sha256": "c071c359c09dccb2318864fee02f17a30aec5004443944918afb819e4bc01f27"
    },
    {
      "media_type": "application/json",
      "not_authority_for": [
        "identity",
        "body",
        "hair",
        "outfit"
      ],
      "reference_id": "std.interior.gallery_morning_gloss.lighting",
      "role": "lighting_anchor",
      "sha256": "41bd4162e9410e4c815dc84d06f16c44a8e36ee51ef177e962583f289213d600"
    },
    {
      "media_type": "application/json",
      "not_authority_for": [
        "identity",
        "body",
        "hair",
        "outfit"
      ],
      "reference_id": "std.interior.gallery_morning_gloss.composition",
      "role": "composition_anchor",
      "sha256": "2217cac41aee3f4b30716465a41fee37885fd02ad84e8c3a51b8c4a210b6b03b"
    },
    {
      "media_type": "application/json",
      "not_authority_for": [
        "identity",
        "body",
        "hair",
        "outfit"
      ],
      "reference_id": "std.interior.gallery_morning_gloss.palette",
      "role": "palette_anchor",
      "sha256": "cb06747114643ef5787c8a2afb25007c974ef96f65e4d7396cf8bac2e7d3e2c7"
    },
    {
      "media_type": "application/json",
      "not_authority_for": [
        "identity",
        "body",
        "hair",
        "outfit"
      ],
      "reference_id": "std.interior.gallery_morning_gloss.negative",
      "role": "negative_reference",
      "sha256": "e36b1aee7b596794701ac7706b12aa9df243b6c0e3fdb386f33f1554b249f0d1"
    }
  ],
  "schema_version": "1.0.0",
  "source_ledger": {
    "created_at": "2026-07-23T09:40:00Z",
    "ledger_id": "ledger.std.interior.gallery_morning_gloss.v1",
    "preset_id": "std.interior.gallery_morning_gloss",
    "preset_version": "1.0.0",
    "revision": 1,
    "schema_version": "1.0.0",
    "sources": [
      {
        "content_sha256": "3fc6c4950e5ef3458fe32d6612d7f810781273fb2ba3d820b48423f18f8bac9f",
        "not_authority_for": [
          "identity",
          "body",
          "hair",
          "outfit",
          "brands",
          "readable_text",
          "exact_architecture"
        ],
        "retrieved_at": "2026-07-23T09:40:00Z",
        "rights": {
          "basis": "LICENSED",
          "evidence_sha256": "b2fd5090492719bd8f3c9779be0650b29cc37bb286a2ea0bf0cf0eff88f127e8",
          "evidence_uri": "evidence/licenses/pexels-license-2026-07-23.md",
          "rights_holder": "Alexey K. via Pexels license",
          "status": "VERIFIED",
          "verified_at": "2026-07-23T09:40:00Z"
        },
        "role": "environment_and_composition_inspiration",
        "snapshot_uri": "evidence/scene-sources/pexels.30699852.json",
        "source_id": "pexels.30699852",
        "url": "https://www.pexels.com/photo/minimalist-empty-modern-interior-with-high-windows-30699852/",
        "use": "high-window scale, quiet gallery proportion and daylight direction only"
      },
      {
        "content_sha256": "ae7e6e54b633b692aee978d196b4c402b94b4c3e4a0dea1ad3aa8b5e98fe692e",
        "not_authority_for": [
          "identity",
          "body",
          "hair",
          "outfit",
          "brands",
          "readable_text",
          "exact_architecture"
        ],
        "retrieved_at": "2026-07-23T09:40:00Z",
        "rights": {
          "basis": "LICENSED",
          "evidence_sha256": "b2fd5090492719bd8f3c9779be0650b29cc37bb286a2ea0bf0cf0eff88f127e8",
          "evidence_uri": "evidence/licenses/pexels-license-2026-07-23.md",
          "rights_holder": "Yusuf Çelik via Pexels license",
          "status": "VERIFIED",
          "verified_at": "2026-07-23T09:40:00Z"
        },
        "role": "environment_material_inspiration",
        "snapshot_uri": "evidence/scene-sources/pexels.18132317.json",
        "source_id": "pexels.18132317",
        "url": "https://www.pexels.com/photo/interior-of-an-empty-industrial-room-18132317/",
        "use": "secondary wall and floor material restraint only"
      }
    ],
    "status": "VERIFIED_FOR_RELEASE"
  },
  "version": "1.1.0"
}
